{
  "$schema": "./schemas/catalog.schema.json",
  "schemaVersion": 1,
  "publisher": "NewbieCheng Team",
  "repository": "https://github.com/NewbieCheng/company-skills-marketplace",
  "projects": [
    {
      "id": "jiujiang",
      "displayName": "九江",
      "description": "九江双蒸私域项目——内容运营、私域转化与用户运营 Skill 集。"
    },
    {
      "id": "social-media",
      "displayName": "社媒",
      "description": "公开趋势研究、内容策划与社交媒体工作流。"
    }
  ],
  "packages": [
    {
      "id": "social-media-hotspot-brief",
      "displayName": "社媒 · 公开热点简报",
      "project": "social-media",
      "version": "1.0.0",
      "description": "研究当前公开热点，保留来源和公开指标，输出 Markdown 与结构化 JSON。",
      "pluginPath": "plugins/social-media-hotspot-brief",
      "skillPaths": [
        "plugins/social-media-hotspot-brief/skills/hotspot-brief-public"
      ],
      "platforms": ["windows", "macos", "linux"],
      "dependencies": []
    },
    {
      "id": "jiujiang-hangge-pengyouquan",
      "displayName": "九江 · 航哥朋友圈内容运营",
      "project": "jiujiang",
      "version": "2.1.0",
      "description": "为九江双蒸私域团队规划、撰写、改写和审核航哥朋友圈内容。把真实经营资料转成\"航哥本人会发\"的朋友圈，有经营目的、有事实依据、有专业标准和生活画面。",
      "pluginPath": "plugins/jiujiang-hangge-pengyouquan",
      "skillPaths": [
        "plugins/jiujiang-hangge-pengyouquan/skills/hangge-peng-you-quan"
      ],
      "platforms": ["windows", "macos", "linux"],
      "dependencies": []
    },
    {
      "id": "jiujiang-user-hypothesis",
      "displayName": "九江 · 用户假设报告",
      "project": "jiujiang",
      "version": "2.0.0",
      "description": "帮运营在正式卖货前，先判断\"谁最可能买、为什么买、为什么不买、先验证什么\"，避免一上来就凭感觉写卖点、做海报、推错人群。",
      "pluginPath": "plugins/jiujiang-user-hypothesis",
      "skillPaths": [
        "plugins/jiujiang-user-hypothesis/skills/jiujiang-shuangzheng-user-hypothesis"
      ],
      "platforms": ["windows", "macos", "linux"],
      "dependencies": []
    },
    {
      "id": "jiujiang-selling-point-card",
      "displayName": "九江 · 产品卖点卡",
      "project": "jiujiang",
      "version": "2.2.0",
      "description": "分析、提炼和梳理具体产品的卖点，输出\"先打什么卖点、对谁说、凭什么说、哪些能说、缺什么证据\"，帮运营在详情页和朋友圈之前先想清楚产品该卖什么。",
      "pluginPath": "plugins/jiujiang-selling-point-card",
      "skillPaths": [
        "plugins/jiujiang-selling-point-card/skills/jiujiang-shuangzheng-product-selling-point-card"
      ],
      "platforms": ["windows", "macos", "linux"],
      "dependencies": []
    },
    {
      "id": "jiujiang-product-material-organizer",
      "displayName": "九江 · 产品素材整理入库",
      "project": "jiujiang",
      "version": "1.0.0",
      "description": "把客户提供的产品素材按图片/视频/文档分类，自动判断产品归属和图片场景，生成入库预案后经确认归档到 Obsidian 产品素材库。",
      "pluginPath": "plugins/jiujiang-product-material-organizer",
      "skillPaths": [
        "plugins/jiujiang-product-material-organizer/skills/jiujiang-shuangzheng-product-material-organizer"
      ],
      "platforms": ["windows", "macos", "linux"],
      "dependencies": []
    }
  ]
}
